{"$schema":"https://json-schema.org/draft/2020-12/schema","$id":"schemas/command.schema.json","title":"EngineCommand","type":"object","additionalProperties":false,"required":["command_id","command_type","issued_at","actor_id","actor_role","expedition_id","idempotency_key","payload"],"properties":{"command_id":{"type":"string","pattern":"^cmd_[a-zA-Z0-9_-]+$"},"command_type":{"enum":["create_expedition","invite_participant","accept_invitation","revoke_invitation","add_participant","ban_participant","unban_participant","generate_rotation","start_expedition","request_stage_advance","advance_stage","override_stage_advance","process_day_boundary","recover_day_transition","force_day_transition","rewind_day","start_evening_session","acknowledge_card","start_task","block_task","complete_task","waive_task","confirm_output","request_day_close","close_day","close_expedition","override_day_close","override_role_assignment","activate_recovery_day","suspend_program","resume_program","create_decision_draft","create_vote","vote","finalize_product_decision","override_product_decision","verify_role_assignment","adjust_role_xp","publish_rating_snapshot"]},"issued_at":{"type":"string","format":"date-time"},"actor_id":{"type":"string","minLength":1},"actor_role":{"enum":["captain","product_captain","participant","shore_operator","system","system_clock"]},"expedition_id":{"type":"string","pattern":"^[a-z0-9_]+$"},"idempotency_key":{"type":"string","minLength":1},"day_number":{"type":["integer","null"],"minimum":1,"maximum":12},"stage_id":{"type":["string","null"],"pattern":"^[a-z0-9_]+$"},"device_id":{"type":["string","null"]},"payload":{"type":"object"},"day_revision":{"type":["integer","null"],"minimum":1}},"allOf":[{"if":{"properties":{"command_type":{"const":"create_expedition"}},"required":["command_type"]},"then":{"properties":{"payload":{"type":"object","required":["name","timezone","duration_days","day_boundary_local_time"],"properties":{"name":{"type":"string","minLength":1},"timezone":{"type":"string","minLength":1},"duration_days":{"type":"integer","minimum":1},"day_boundary_local_time":{"type":"string","pattern":"^([01]\\d|2[0-3]):[0-5]\\d$"}},"additionalProperties":true}}}},{"if":{"properties":{"command_type":{"const":"invite_participant"}},"required":["command_type"]},"then":{"properties":{"payload":{"type":"object","required":["email","invitation_token"],"properties":{"email":{"type":"string","format":"email","minLength":3,"maxLength":254},"invitation_token":{"type":"string","pattern":"^[A-Za-z0-9_-]{43}$"}},"additionalProperties":false}}}},{"if":{"properties":{"command_type":{"const":"accept_invitation"}},"required":["command_type"]},"then":{"properties":{"payload":{"type":"object","required":["invitation_token","display_name"],"properties":{"invitation_token":{"type":"string","pattern":"^[A-Za-z0-9_-]{43}$"},"display_name":{"type":"string","minLength":1,"maxLength":200}},"additionalProperties":false}}}},{"if":{"properties":{"command_type":{"const":"revoke_invitation"}},"required":["command_type"]},"then":{"properties":{"payload":{"type":"object","required":["invitation_id","reason"],"properties":{"invitation_id":{"type":"string","pattern":"^invitation_[a-f0-9]{32}$"},"reason":{"type":"string","minLength":1,"maxLength":2000}},"additionalProperties":false}}}},{"if":{"properties":{"command_type":{"const":"add_participant"}},"required":["command_type"]},"then":{"properties":{"payload":{"type":"object","required":["participant_id","display_name"],"properties":{"participant_id":{"type":"string","minLength":1},"display_name":{"type":"string","minLength":1}},"additionalProperties":true}}}},{"if":{"properties":{"command_type":{"const":"generate_rotation"}},"required":["command_type"]},"then":{"properties":{"payload":{"type":"object","required":["seed","rules_version"],"properties":{"seed":{"type":["string","integer"]},"rules_version":{"type":["integer","string"]}},"additionalProperties":true}}}},{"if":{"properties":{"command_type":{"const":"start_expedition"}},"required":["command_type"]},"then":{"properties":{"payload":{"type":"object","required":[],"properties":{},"additionalProperties":true}}}},{"if":{"properties":{"command_type":{"const":"request_stage_advance"}}},"then":{"properties":{"payload":{"type":"object","required":["from_stage_id","to_stage_id","requested_for_day_number"],"properties":{"from_stage_id":{"type":"string","pattern":"^[a-z0-9_]+$"},"to_stage_id":{"type":"string","pattern":"^[a-z0-9_]+$"},"requested_for_day_number":{"type":"integer","minimum":1,"maximum":12}},"additionalProperties":true}}}},{"if":{"properties":{"command_type":{"const":"advance_stage"}}},"then":{"properties":{"payload":{"type":"object","required":["from_stage_id","to_stage_id","effective_from_day_number"],"properties":{"from_stage_id":{"type":"string","pattern":"^[a-z0-9_]+$"},"to_stage_id":{"type":"string","pattern":"^[a-z0-9_]+$"},"effective_from_day_number":{"type":"integer","minimum":1,"maximum":12},"request_event_id":{"type":["string","null"],"pattern":"^evt_[a-zA-Z0-9_-]+$"}},"additionalProperties":true}}}},{"if":{"properties":{"command_type":{"const":"override_stage_advance"}}},"then":{"properties":{"payload":{"type":"object","required":["from_stage_id","to_stage_id","effective_from_day_number","reason","unmet_conditions"],"properties":{"from_stage_id":{"type":"string","pattern":"^[a-z0-9_]+$"},"to_stage_id":{"type":"string","pattern":"^[a-z0-9_]+$"},"effective_from_day_number":{"type":"integer","minimum":1,"maximum":12},"reason":{"type":"string","minLength":1},"unmet_conditions":{"type":"array","items":{"type":"string"},"uniqueItems":true}},"additionalProperties":true}}}},{"if":{"properties":{"command_type":{"const":"process_day_boundary"}},"required":["command_type"]},"then":{"properties":{"payload":{"type":"object","required":["local_calendar_date","boundary_at"],"properties":{"local_calendar_date":{"type":"string","format":"date"},"boundary_at":{"type":"string","format":"date-time"}},"additionalProperties":true}}}},{"if":{"properties":{"command_type":{"const":"recover_day_transition"}},"required":["command_type"]},"then":{"properties":{"payload":{"type":"object","required":["local_calendar_date","reason"],"properties":{"local_calendar_date":{"type":"string","format":"date"},"reason":{"type":"string","minLength":1}},"additionalProperties":true}}}},{"if":{"properties":{"command_type":{"const":"start_evening_session"}},"required":["command_type"]},"then":{"properties":{"payload":{"type":"object","required":["day_number","stage_id"],"properties":{"day_number":{"type":"integer","minimum":1},"stage_id":{"type":"string","minLength":1}},"additionalProperties":true}}}},{"if":{"properties":{"command_type":{"const":"acknowledge_card"}},"required":["command_type"]},"then":{"properties":{"payload":{"type":"object","required":["card_id"],"properties":{"card_id":{"type":"string","minLength":1}},"additionalProperties":true}}}},{"if":{"properties":{"command_type":{"const":"start_task"}},"required":["command_type"]},"then":{"properties":{"payload":{"type":"object","required":["task_id"],"properties":{"task_id":{"type":"string","minLength":1}},"additionalProperties":true}}}},{"if":{"properties":{"command_type":{"const":"block_task"}},"required":["command_type"]},"then":{"properties":{"payload":{"type":"object","required":["task_id","reason"],"properties":{"task_id":{"type":"string","minLength":1},"reason":{"type":"string","minLength":1}},"additionalProperties":true}}}},{"if":{"properties":{"command_type":{"const":"complete_task"}},"required":["command_type"]},"then":{"properties":{"payload":{"type":"object","required":["task_id"],"properties":{"task_id":{"type":"string","minLength":1}},"additionalProperties":true}}}},{"if":{"properties":{"command_type":{"const":"waive_task"}},"required":["command_type"]},"then":{"properties":{"payload":{"type":"object","required":["task_id","reason"],"properties":{"task_id":{"type":"string","minLength":1},"reason":{"type":"string","minLength":1}},"additionalProperties":true}}}},{"if":{"properties":{"command_type":{"const":"confirm_output"}},"required":["command_type"]},"then":{"properties":{"payload":{"type":"object","required":["stage_id","output_id","evidence_refs"],"properties":{"stage_id":{"type":"string","minLength":1},"output_id":{"type":"string","minLength":1},"evidence_refs":{"type":"array","items":{"type":"string"},"uniqueItems":true}},"additionalProperties":true}}}},{"if":{"properties":{"command_type":{"const":"request_day_close"}},"required":["command_type"]},"then":{"properties":{"payload":{"type":"object","required":["day_number"],"properties":{"day_number":{"type":"integer","minimum":1}},"additionalProperties":true}}}},{"if":{"properties":{"command_type":{"const":"close_day"}},"required":["command_type"]},"then":{"properties":{"payload":{"type":"object","required":["day_number"],"properties":{"day_number":{"type":"integer","minimum":1}},"additionalProperties":true}}}},{"if":{"properties":{"command_type":{"const":"close_expedition"}},"required":["command_type"]},"then":{"properties":{"payload":{"type":"object","required":["final_stage_id","final_day_number","shore_package_ref","completion_summary","expected_projection_version"],"properties":{"final_stage_id":{"const":"demo_day"},"final_day_number":{"const":12},"shore_package_ref":{"type":"string","minLength":1},"completion_summary":{"type":"string","minLength":1},"expected_projection_version":{"type":"integer","minimum":0}},"additionalProperties":true}}}},{"if":{"properties":{"command_type":{"const":"override_day_close"}},"required":["command_type"]},"then":{"properties":{"payload":{"type":"object","required":["day_number","reason","unmet_conditions"],"properties":{"day_number":{"type":"integer","minimum":1},"reason":{"type":"string","minLength":1},"unmet_conditions":{"type":"array","items":{"type":"string"},"uniqueItems":true}},"additionalProperties":true}}}},{"if":{"properties":{"command_type":{"const":"override_role_assignment"}},"required":["command_type"]},"then":{"properties":{"payload":{"type":"object","required":["participant_id","role_type","previous_role_id","new_role_id","reason"],"properties":{"participant_id":{"type":"string","minLength":1},"role_type":{"enum":["product","onboard"]},"previous_role_id":{"type":"string","minLength":1},"new_role_id":{"type":"string","minLength":1},"reason":{"type":"string","minLength":1}},"additionalProperties":true}}}},{"if":{"properties":{"command_type":{"const":"activate_recovery_day"}},"required":["command_type"]},"then":{"properties":{"payload":{"type":"object","required":["local_calendar_date","reason"],"properties":{"local_calendar_date":{"type":"string","format":"date"},"reason":{"type":"string","minLength":1}},"additionalProperties":true}}}},{"if":{"properties":{"command_type":{"const":"suspend_program"}},"required":["command_type"]},"then":{"properties":{"payload":{"type":"object","required":["reason"],"properties":{"reason":{"type":"string","minLength":1}},"additionalProperties":true}}}},{"if":{"properties":{"command_type":{"const":"resume_program"}},"required":["command_type"]},"then":{"properties":{"payload":{"type":"object","required":[],"properties":{},"additionalProperties":true}}}},{"if":{"properties":{"command_type":{"const":"force_day_transition"}},"required":["command_type"]},"then":{"properties":{"payload":{"type":"object","required":["target_local_calendar_date","reason","expected_projection_version"],"properties":{"target_local_calendar_date":{"type":"string","format":"date"},"reason":{"type":"string","minLength":1},"expected_projection_version":{"type":"integer","minimum":0}},"additionalProperties":true}}}},{"if":{"properties":{"command_type":{"const":"rewind_day"}},"required":["command_type"]},"then":{"properties":{"payload":{"type":"object","required":["from_day_number","to_day_number","reason","expected_projection_version"],"properties":{"from_day_number":{"type":"integer","minimum":1,"maximum":12},"to_day_number":{"type":"integer","minimum":1,"maximum":12},"reason":{"type":"string","minLength":1},"expected_projection_version":{"type":"integer","minimum":0}},"additionalProperties":true}}}},{"if":{"properties":{"command_type":{"const":"ban_participant"}},"required":["command_type"]},"then":{"properties":{"payload":{"type":"object","required":["participant_id","reason","effective_at"],"properties":{"participant_id":{"type":"string","minLength":1},"reason":{"type":"string","minLength":1},"effective_at":{"type":"string","format":"date-time"}},"additionalProperties":true}}}},{"if":{"properties":{"command_type":{"const":"unban_participant"}},"required":["command_type"]},"then":{"properties":{"payload":{"type":"object","required":["participant_id","reason","effective_at"],"properties":{"participant_id":{"type":"string","minLength":1},"reason":{"type":"string","minLength":1},"effective_at":{"type":"string","format":"date-time"}},"additionalProperties":true}}}},{"if":{"properties":{"command_type":{"const":"create_decision_draft"}},"required":["command_type"]},"then":{"properties":{"payload":{"type":"object","required":["decision_id","stage_id","question","options","criteria","evidence_refs"],"properties":{"decision_id":{"type":"string","pattern":"^[a-z0-9_]+$"},"stage_id":{"const":"product_decision"},"question":{"type":"string","minLength":1},"options":{"type":"array","minItems":2,"maxItems":5,"items":{"type":"object","required":["option_id","title"],"properties":{"option_id":{"type":"string","pattern":"^[a-z0-9_]+$"},"title":{"type":"string","minLength":1},"summary":{"type":"string"}},"additionalProperties":false},"uniqueItems":true},"criteria":{"type":"array","minItems":1,"items":{"type":"string","minLength":1}},"evidence_refs":{"type":"array","items":{"type":"string","minLength":1},"uniqueItems":true}},"additionalProperties":true}}}},{"if":{"properties":{"command_type":{"const":"create_vote"}},"required":["command_type"]},"then":{"properties":{"payload":{"type":"object","required":["vote_id","decision_id","eligible_voter_ids","vote_mode","quorum_rule","threshold_rule","round_version"],"properties":{"vote_id":{"type":"string","pattern":"^[a-z0-9_]+$"},"decision_id":{"type":"string","pattern":"^[a-z0-9_]+$"},"eligible_voter_ids":{"type":"array","minItems":3,"maxItems":6,"items":{"type":"string","minLength":1},"uniqueItems":true},"vote_mode":{"const":"single_choice"},"quorum_rule":{"const":"all_eligible"},"threshold_rule":{"const":"strict_majority_of_eligible"},"round_version":{"type":"integer","minimum":1}},"additionalProperties":true}}}},{"if":{"properties":{"command_type":{"const":"vote"}},"required":["command_type"]},"then":{"properties":{"payload":{"type":"object","required":["vote_id","choice","ballot_revision"],"properties":{"vote_id":{"type":"string","pattern":"^[a-z0-9_]+$"},"choice":{"type":"string","minLength":1},"ballot_revision":{"type":"integer","minimum":1},"reason":{"type":"string"}},"additionalProperties":true}}}},{"if":{"properties":{"command_type":{"const":"finalize_product_decision"}},"required":["command_type"]},"then":{"properties":{"payload":{"type":"object","required":["vote_id","decision_id","selected_option_id","rationale","rejected_option_ids","objection_summary","evidence_refs","expected_round_version"],"properties":{"vote_id":{"type":"string","pattern":"^[a-z0-9_]+$"},"decision_id":{"type":"string","pattern":"^[a-z0-9_]+$"},"selected_option_id":{"type":"string","pattern":"^[a-z0-9_]+$"},"rationale":{"type":"string","minLength":1},"rejected_option_ids":{"type":"array","minItems":1,"items":{"type":"string","pattern":"^[a-z0-9_]+$"},"uniqueItems":true},"objection_summary":{"type":"array","items":{"type":"string","minLength":1}},"evidence_refs":{"type":"array","items":{"type":"string","minLength":1},"uniqueItems":true},"expected_round_version":{"type":"integer","minimum":1}},"additionalProperties":true}}}},{"if":{"properties":{"command_type":{"const":"override_product_decision"}},"required":["command_type"]},"then":{"properties":{"payload":{"type":"object","required":["vote_id","decision_id","selected_option_id","reason","unresolved_objections","evidence_refs","expected_round_version"],"properties":{"vote_id":{"type":"string","pattern":"^[a-z0-9_]+$"},"decision_id":{"type":"string","pattern":"^[a-z0-9_]+$"},"selected_option_id":{"type":"string","pattern":"^[a-z0-9_]+$"},"reason":{"type":"string","minLength":1},"unresolved_objections":{"type":"array","minItems":1,"items":{"type":"string","minLength":1}},"evidence_refs":{"type":"array","items":{"type":"string","minLength":1},"uniqueItems":true},"expected_round_version":{"type":"integer","minimum":1}},"additionalProperties":true}}}},{"if":{"properties":{"command_type":{"const":"verify_role_assignment"}},"required":["command_type"]},"then":{"properties":{"payload":{"type":"object","required":["assignment_id","participant_id","role_id","role_type","outcome","evidence_refs","expected_assignment_version"],"properties":{"assignment_id":{"type":"string","pattern":"^[a-z0-9_]+$"},"participant_id":{"type":"string","pattern":"^[a-z0-9_]+$"},"role_id":{"type":"string","pattern":"^[a-z0-9_]+$"},"role_type":{"enum":["product","onboard"]},"outcome":{"enum":["completed","partial","waived"]},"evidence_refs":{"type":"array","items":{"type":"string","minLength":1},"uniqueItems":true},"expected_assignment_version":{"type":"integer","minimum":1},"reason":{"type":"string","minLength":1}},"additionalProperties":true}}}},{"if":{"properties":{"command_type":{"const":"adjust_role_xp"}},"required":["command_type"]},"then":{"properties":{"payload":{"type":"object","required":["adjustment_id","participant_id","role_id","delta","reason","evidence_refs","expected_balance_version"],"properties":{"adjustment_id":{"type":"string","pattern":"^[a-z0-9_]+$"},"participant_id":{"type":"string","pattern":"^[a-z0-9_]+$"},"role_id":{"type":"string","pattern":"^[a-z0-9_]+$"},"delta":{"type":"integer","minimum":-1000,"maximum":1000,"not":{"const":0}},"reason":{"type":"string","minLength":1},"evidence_refs":{"type":"array","items":{"type":"string","minLength":1},"uniqueItems":true},"expected_balance_version":{"type":"integer","minimum":0},"correction_of":{"type":"string","pattern":"^evt_[a-z0-9_]+$"}},"additionalProperties":true}}}},{"if":{"properties":{"command_type":{"const":"publish_rating_snapshot"}},"required":["command_type"]},"then":{"properties":{"payload":{"type":"object","required":["day_number","day_revision","rules_version","projection_version"],"properties":{"day_number":{"type":"integer","minimum":1,"maximum":12},"day_revision":{"type":"integer","minimum":1},"rules_version":{"type":"integer","minimum":1},"projection_version":{"type":"integer","minimum":1}},"additionalProperties":true}}}}]}
