[
  {
    "command_id": "cmd_setup_invite_01",
    "command_type": "invite_participant",
    "issued_at": "2026-07-21T16:00:00+02:00",
    "actor_id": "captain_01",
    "actor_role": "captain",
    "expedition_id": "ilka_setup_demo",
    "idempotency_key": "cmd_setup_invite_01",
    "payload": {
      "email": "anna@example.test",
      "invitation_token": "AAAAAAAAAAAAAAAAAAAAAAAAAAAAAAAAAAAAAAAAAAA"
    }
  },
  {
    "command_id": "cmd_setup_accept_01",
    "command_type": "accept_invitation",
    "issued_at": "2026-07-21T16:05:00+02:00",
    "actor_id": "cf4a92a2-24ed-423f-aedb-78346b70acbd",
    "actor_role": "participant",
    "expedition_id": "ilka_setup_demo",
    "idempotency_key": "cmd_setup_accept_01",
    "payload": {
      "invitation_token": "AAAAAAAAAAAAAAAAAAAAAAAAAAAAAAAAAAAAAAAAAAA",
      "display_name": "Anna"
    }
  },
  {
    "command_id": "cmd_setup_revoke_02",
    "command_type": "revoke_invitation",
    "issued_at": "2026-07-21T16:10:00+02:00",
    "actor_id": "captain_01",
    "actor_role": "captain",
    "expedition_id": "ilka_setup_demo",
    "idempotency_key": "cmd_setup_revoke_02",
    "payload": {
      "invitation_id": "invitation_22222222222222222222222222222222",
      "reason": "Participant cannot join the expedition."
    }
  },
  {
    "command_id": "cmd_setup_rotation_01",
    "command_type": "generate_rotation",
    "issued_at": "2026-07-21T17:00:00+02:00",
    "actor_id": "member_eeeeeeeeeeeeeeeeeeeeeeeeeeeeeeee",
    "actor_role": "captain",
    "expedition_id": "ilka_setup_demo",
    "idempotency_key": "cmd_setup_rotation_01",
    "day_number": null,
    "stage_id": null,
    "day_revision": null,
    "payload": {}
  }
]
